lfdNr_Auftrag;Verkaufsburo;Auftraggeber;Regulierer;Rechnungsempf;Warenempfänger;Zahlungsbedingung;Bestellnummer;Vertrag;Wunschlieferdatum;Preisdatum;Leisterstdatum;Kartennummer;Submission;Kopftext;Zusatzleistungen Kopf;Materialnummer;Menge;Gewicht;Anzahl Pakete;Anzahl Palette;Titel;GZ;FaktID;Auftrag;ZMAN;ZMA1;Positionstext;Zusatzleistungen Position;Ende
1;403;223322;;;;;e-Gehaltszettel / EBPP;;20250731;;;;;;;60107009;12;;;;;;;;;4,94;IY9VDV BB Dialyse GmbH;;X
1;430;223322;;;;;e-Gehaltszettel / EBPP;;20250731;;;;;;;60107012;1;;;;;;;;;49;Add-On Digitale Signatur und Mitarbeiter upload;;X
1;403;AQUA SAP;;;;;e-Gehaltszettel / EBPP;;20250731;;;;;;;60107009;136;;;;;;;;;56,00;AQUA AQUA GmbH;;X
1;430;AQUA SAP;;;;;e-Gehaltszettel / EBPP;;20250731;;;;;;;60107012;1;;;;;;;;;49;Add-On Digitale Signatur und Mitarbeiter upload;;X
1;403;123;;;;;e-Gehaltszettel / EBPP;;20250731;;;;;;;60107009;3;;;;;;;;;1,24;DEVTEST Dev test;;X
